<?xml version="1.0" encoding="utf-8"?>
<!--XML file automatically generated by WorkVisual V6.0.31_Build3247.-->
<!--DO NOT EDIT-->
<WaggonDriverConfig xsi:noNamespaceSchemaLocation="../../../System/Common/Schemes/WaggonDriverConfig.xsd" xmlns:xsi="http://www.w3.org/2001/XMLSchema-instance">
  <Version Label="">
    <Info Version="KUKA V8.7" />
    <Schema Version="1" />
  </Version>
  <WaggonDriver ID="106">
    <!--KPP-Supply Daten-Kanal 1 von KPP-->
    <Input>
      <Offset VendorID="24776" ProductCode="131" VarName="FSoE-Drive In.Supplier status" Occurrence="0" />
    </Input>
    <Output>
      <Offset VendorID="24776" ProductCode="131" VarName="FSoE-Drive Out.Supplier control" Occurrence="0" />
    </Output>
  </WaggonDriver>
  <WaggonDriver ID="100">
    <!--CCFRDC3 Resolver Digital Converter-->
    <Input>
      <Offset VendorID="24776" ProductCode="48" VarName="FSoE-Drive In.Position 1" Occurrence="0" />
      <Offset VendorID="24776" ProductCode="48" VarName="FSoE-Drive In.Position 2" Occurrence="0" />
      <Offset VendorID="24776" ProductCode="48" VarName="FSoE-Drive In.Position 3" Occurrence="0" />
      <Offset VendorID="24776" ProductCode="48" VarName="FSoE-Drive In.Position 4" Occurrence="0" />
      <Offset VendorID="24776" ProductCode="48" VarName="FSoE-Drive In.Position 5" Occurrence="0" />
    </Input>
    <AdditionalOffsets type="global">
      <Input>
        <Offset VendorID="24776" ProductCode="48" VarName="FSoE-Drive In.Command" Occurrence="0" WDVarDescription="RDC-Global-Data" />
      </Input>
    </AdditionalOffsets>
  </WaggonDriver>
  <WaggonDriver ID="101">
    <!--KSP-Daten-Kanaele von KSP-->
    <Input>
      <Offset VendorID="24776" ProductCode="131" VarName="FSoE-Drive In.Motor status 1" Occurrence="0" />
      <Offset VendorID="24776" ProductCode="131" VarName="FSoE-Drive In.Motor status 2" Occurrence="0" />
      <Offset VendorID="24776" ProductCode="131" VarName="FSoE-Drive In.Motor status 3" Occurrence="0" />
      <Offset VendorID="24776" ProductCode="131" VarName="FSoE-Drive In.Motor status 5" Occurrence="0" />
      <Offset VendorID="24776" ProductCode="131" VarName="FSoE-Drive In.Motor status 6" Occurrence="0" />
    </Input>
    <Output>
      <Offset VendorID="24776" ProductCode="131" VarName="FSoE-Drive Out.Motor control 1" Occurrence="0" />
      <Offset VendorID="24776" ProductCode="131" VarName="FSoE-Drive Out.Motor control 2" Occurrence="0" />
      <Offset VendorID="24776" ProductCode="131" VarName="FSoE-Drive Out.Motor control 3" Occurrence="0" />
      <Offset VendorID="24776" ProductCode="131" VarName="FSoE-Drive Out.Motor control 5" Occurrence="0" />
      <Offset VendorID="24776" ProductCode="131" VarName="FSoE-Drive Out.Motor control 6" Occurrence="0" />
    </Output>
  </WaggonDriver>
</WaggonDriverConfig>